"original_text","perturbed_text","original_score","perturbed_score","original_output","perturbed_output","ground_truth_output","num_queries","result_type"
"[""When you are driving a manual transmission vehicle, the clutch is used to connect and disconnect the engine from the wheels. When you push the clutch pedal down, it disconnects the engine from the wheels, allowing you to change gears. \nWhen you are braking or coming to a stop, it's important to push the clutch down before you come to a complete stop. This is because if you leave the clutch engaged (not pressed down) while the car is stopped, it can cause the engine to stall. \nStalling the engine can be inconvenient and potentially dangerous, especially if you are driving in heavy traffic or on a busy road. By pushing the clutch down before you come to a stop, you can avoid stalling the engine and ensure a smooth stop. \nIt's also a good habit to get into because it can help you to smoothly shift into neutral when you come to a stop, rather than suddenly trying to find the right gear at the last minute. \nI hope this helps! Let me know if you have any other questions.""]","[""When you are driving a manual transmission vehicle, the clutch is used to connect and disconnect the engine from the wheels. When you push the clutch pedal down, it disconnects the engine from the wheels, allowing you to change gears. \nWhen you are braking or coming to a stop, it's important to push the clutch down before you come to a complete stop. This is because if you leave the clutch engaged (not pressed down) while the car is stopped, it can cause the engine to stall. \nStalling the engine can be inconvenient and potentially dangerous, especially if you are driving in heavy traffic or on a busy road. By pushing the clutch down before you come to a stop, you can avoid stalling the engine and ensure a smooth stop. \nIt's also a good habit to get into because it can help you to smoothly shift into neutral when you come to a stop, rather than suddenly trying to find the right gear at the last minute. \nI hope this helps! Let me know if you have any other questions.""]",0.0,0.0,1,1,1,3321,"Failed"
"['Sure! Radio waves are a type of electromagnetic radiation, just like light or heat. Electromagnetic radiation is a type of energy that travels through the air (and through space) as a wave. \nRadio waves are a type of electromagnetic radiation that travels through the air at the speed of light. They have a longer wavelength than other types of electromagnetic radiation, such as visible light or X-rays. Radio waves are used to transmit information, such as music or news, through the air from one place to another. \nHeadphones and speakers are able to pick up radio waves because they have a small device inside called a radio receiver. The radio receiver is made up of tiny electronic components that are able to detect radio waves and convert them into an electrical signal. When the electrical signal is sent to the speakers, they use it to produce sound waves that we can hear. \nSo, to sum it up: radio waves are a type of energy that travels through the air and can be picked up by a radio receiver inside headphones or speakers, which converts the radio waves into an electrical signal that the speakers use to produce sound waves that we can hear. Does that make sense? Let me know if you have any other questions!']","['Sure! Radio waves are a type of electromagnetic radiation, just like light or heat. Electromagnetic radiation is a type of energy that travels through the air (and through space) as a wave. \nRadio waves are a type of electromagnetic radiation that travels through the air at the speed of light. They have a longer wavelength than other types of electromagnetic radiation, such as visible light or X-rays. Radio waves are used to transmit information, such as music or news, through the air from one place to another. \nHeadphones and speakers are able to pick up radio waves because they have a small device inside called a radio receiver. The radio receiver is made up of tiny electronic components that are able to detect radio waves and convert them into an electrical signal. When the electrical signal is sent to the speakers, they use it to produce sound waves that we can hear. \nSo, to sum it up: radio waves are a type of energy that travels through the air and can be picked up by a radio receiver inside headphones or speakers, which converts the radio waves into an electrical signal that the speakers use to produce sound waves that we can hear. Does that make sense? Let me know if you have any other questions!']",0.0,0.0,1,1,1,3986,"Failed"
"[""People like alcohol for a variety of reasons. Some people enjoy the taste of certain types of alcohol, while others like the way it makes them feel. Some people drink alcohol to relax or to socialize with friends. For some people, drinking alcohol is a way to celebrate special occasions or to mark the end of a long day. \nHowever, it's important to remember that drinking alcohol can also have negative consequences. Alcohol can impair your judgment and coordination, and it can also be addictive. It's important to drink responsibly and to be aware of the risks associated with alcohol consumption. If you decide to drink alcohol, it's a good idea to have a designated driver or another form of transportation to get home safely.""]","[""People like alcohol for a variety of reasons. Some people enjoy the taste of certain types of alcohol, while others like the way it makes them feel. Some people drink alcohol to relax or to socialize with friends. For some people, drinking alcohol is a way to celebrate special occasions or to mark the end of a long day. \nHowever, it's important to remember that drinking alcohol can also have negative consequences. Alcohol can impair your judgment and coordination, and it can also be addictive. It's important to drink responsibly and to be aware of the risks associated with alcohol consumption. If you decide to drink alcohol, it's a good idea to have a designated driver or another form of transportation to get home safely.""]",0.0,0.0,1,1,1,2846,"Failed"
"['There are a few reasons why car and truck companies might not make new vehicles that look like older models with new technology. \nOne reason is that new technology often requires new designs to accommodate it. For example, electric vehicles (EVs) require a different kind of powertrain than gasoline-powered vehicles, and this difference in powertrain might require a different kind of body or frame. \nAnother reason is that car and truck companies want to keep their products fresh and appealing to customers. This means that they might want to update the appearance of their vehicles to reflect current trends and styles. \nFinally, it can be expensive to develop and produce new vehicles, and car and truck companies need to consider whether there is enough demand for a particular type of vehicle to justify the cost. If a company thinks that there is not enough demand for a new vehicle that looks like an older model, they might decide not to invest in creating it. \nI hope this helps to explain things! Let me know if you have any other questions.']","['There are a few reasons why car and truck companies might not make new vehicles that look like older models with new technology. \nOne reason is that new technology often requires new designs to accommodate it. For example, electric vehicles (EVs) require a different kind of powertrain than gasoline-powered vehicles, and this difference in powertrain might require a different kind of body or frame. \nAnother reason is that car and truck companies want to keep their products fresh and appealing to customers. This means that they might want to update the appearance of their vehicles to reflect current trends and styles. \nFinally, it can be expensive to develop and produce new vehicles, and car and truck companies need to consider whether there is enough demand for a particular type of vehicle to justify the cost. If a company thinks that there is not enough demand for a new vehicle that looks like an older model, they might decide not to invest in creating it. \nI hope this helps to explain things! Let me know if you have any other questions.']",0.0,0.0,1,1,1,4111,"Failed"
"[""When you put something in your mouth, the sound waves from the movement of the object can vibrate your teeth and the bones in your head. These vibrations can be picked up by the inner ear, which is responsible for detecting sound and helping us to hear. The inner ear is made up of tiny sensors called hair cells that detect the movement of the bones in our head and send signals to the brain, which interprets these signals as sound. So, when you eat chips and hear the crunching noise, it's because the sound [[waves]] from [[the]] [[movement]] [[of]] the [[chips]] [[are]] vibrating your teeth and the bones in your head, and these vibrations are being detected by the inner ear and interpreted by your brain as sound.""]","[""When you put something in your mouth, the sound waves from the movement of the object can vibrate your teeth and the bones in your head. These vibrations can be picked up by the inner ear, which is responsible for detecting sound and helping us to hear. The inner ear is made up of tiny sensors called hair cells that detect the movement of the bones in our head and send signals to the brain, which interprets these signals as sound. So, when you eat chips and hear the crunching noise, it's because the sound [[indistinct]] from [[both]] [[transference]] [[among]] the [[microprocessor]] [[stay]] vibrating your teeth and the bones in your head, and these vibrations are being detected by the inner ear and interpreted by your brain as sound.""]",0.0,0.9765625,1,0,1,1903,"Successful"
"['The quality of the glass is different , but more importantly the size of the prodction line , the ease with which you transport a case of beer compared to fragile goods like wine glasses , and you are missing intellectual property rights . Typically , all beer bottles look basically the same and no "" real "" cost has to be paid to designers . A designer can take a big percentage . Also , there are expensive beers , and cheap wine glasses . You wo n\'t pay that at IKEA .'<SPLIT> ""Not only is it an issue of quality , it 's an issue of what people are willing to pay . It 's like comparing golf clubs to baseball bats . Different production costs , different customers , etc .""<SPLIT> 'More effort goes into creating , shipping , handling and in general getting those 4 wine glasses into your hands than it takes to fill 24 factory made glass bottles in a beer filling factory and getting them to your local supermaket . It is not so much the cost of the material , as it is the cost of various people involved in getting the end product to you . Materials are cheap , labour is expensive .']","['The quality of the glass is different , but more importantly the size of the prodction line , the ease with which you transport a case of beer compared to fragile goods like wine glasses , and you are missing intellectual property rights . Typically , all beer bottles look basically the same and no "" real "" cost has to be paid to designers . A designer can take a big percentage . Also , there are expensive beers , and cheap wine glasses . You wo n\'t pay that at IKEA .'<SPLIT> ""Not only is it an issue of quality , it 's an issue of what people are willing to pay . It 's like comparing golf clubs to baseball bats . Different production costs , different customers , etc .""<SPLIT> 'More effort goes into creating , shipping , handling and in general getting those 4 wine glasses into your hands than it takes to fill 24 factory made glass bottles in a beer filling factory and getting them to your local supermaket . It is not so much the cost of the material , as it is the cost of various people involved in getting the end product to you . Materials are cheap , labour is expensive .']",0.0,0.0,0,0,0,3769,"Failed"
"[""There are many possible reasons why someone who commits murder might also commit suicide. One possibility is that the person who committed the murder is feeling overwhelmed by guilt or remorse for what they have done. They may feel like they cannot face the consequences of their actions and decide to take their own life. Another possibility is that the person who committed the murder was suffering from a mental illness or had a history of mental health problems. In these cases, the person may have been in a state of extreme distress or confusion and may have felt that ending their own life was the only way to find relief. It's important to note that every situation is unique and there may be many different factors that contribute to a person committing both murder and suicide.""]","[""There are many possible reasons why someone who commits murder might also commit suicide. One possibility is that the person who committed the murder is feeling overwhelmed by guilt or remorse for what they have done. They may feel like they cannot face the consequences of their actions and decide to take their own life. Another possibility is that the person who committed the murder was suffering from a mental illness or had a history of mental health problems. In these cases, the person may have been in a state of extreme distress or confusion and may have felt that ending their own life was the only way to find relief. It's important to note that every situation is unique and there may be many different factors that contribute to a person committing both murder and suicide.""]",0.0,0.0,1,1,1,3124,"Failed"
"[""Well anywhere you go in the country you have weather issues , if it 's the Midwest you 'll have tornadoes . Do it in the South and you get hurricanes . Do it in the Southwest and you 'll probably have a lot of sand related delays ( i.e. desert storms ) . But one of the main reasons it was picked was because of safety . If a rocket or shuttle was to explode mid air after takeoff the debris and what not would sprinkle over the ocean , away from land and population centers . Launches always go eastward . When you launch headed east , you gain the rotation of the Earth in terms of acceleration . And so you do n't have to have quite as powerful a rocket . Also , when the Cape Canaveral Space station was first established it was pretty desolate just marshes and farms . It 's also close to key navy and air force bases . The area they built on also offered good supply routes unlike the Soviets who when they built their launch areas out in Kazakhstan had to strain themselves to build infrastructure . [ Source ] ( URL_0 ) if you want to read up on it more .""<SPLIT> ""It 's really far south . The closer you are to the equator , the easier space launches get . The parts of Texas that are that far south area pretty stormy too .""<SPLIT> ""Cape Canaveral was chosen because : 1 . It 's geographic location is as close as can be on the US mainland to the equator , which makes launching easier 2 . Florida has a relatively stable and predictable temperature range and weather patterns . 3 . It 's near water in the direction that rockets go , which is helpful for emergency splashdowns 4 . At the time it was built , it was in a relatively unpopulated area . This alleviated noise concerns as well as minimizing collateral damage should accidents occur . Also , in case you are wondering , why is Houston the command center and not Florida ? Because Lyndon Johnson was president at the time all this infrastructure was being built and he was from Houston and was simply seeing to it that his home state and home city benefited .""]","[""Well anywhere you go in the country you have weather issues , if it 's the Midwest you 'll have tornadoes . Do it in the South and you get hurricanes . Do it in the Southwest and you 'll probably have a lot of sand related delays ( i.e. desert storms ) . But one of the main reasons it was picked was because of safety . If a rocket or shuttle was to explode mid air after takeoff the debris and what not would sprinkle over the ocean , away from land and population centers . Launches always go eastward . When you launch headed east , you gain the rotation of the Earth in terms of acceleration . And so you do n't have to have quite as powerful a rocket . Also , when the Cape Canaveral Space station was first established it was pretty desolate just marshes and farms . It 's also close to key navy and air force bases . The area they built on also offered good supply routes unlike the Soviets who when they built their launch areas out in Kazakhstan had to strain themselves to build infrastructure . [ Source ] ( URL_0 ) if you want to read up on it more .""<SPLIT> ""It 's really far south . The closer you are to the equator , the easier space launches get . The parts of Texas that are that far south area pretty stormy too .""<SPLIT> ""Cape Canaveral was chosen because : 1 . It 's geographic location is as close as can be on the US mainland to the equator , which makes launching easier 2 . Florida has a relatively stable and predictable temperature range and weather patterns . 3 . It 's near water in the direction that rockets go , which is helpful for emergency splashdowns 4 . At the time it was built , it was in a relatively unpopulated area . This alleviated noise concerns as well as minimizing collateral damage should accidents occur . Also , in case you are wondering , why is Houston the command center and not Florida ? Because Lyndon Johnson was president at the time all this infrastructure was being built and he was from Houston and was simply seeing to it that his home state and home city benefited .""]",0.0,0.0,0,0,0,6686,"Failed"
"[""If Bob is currently serving a sentence for hitting a chicken with a fish and the law has changed so that this action is no longer considered a crime, Bob would likely be able to finish his sentence and then be released from prison. This is because the law that Bob was convicted under no longer exists, and so it would not be fair to continue to punish him for something that is no longer considered a crime. However, it is important to note that this is a complex legal issue and the specifics of Bob's situation would need to be carefully examined in order to determine the appropriate course of action.""]","[""If Bob is currently serving a sentence for hitting a chicken with a fish and the law has changed so that this action is no longer considered a crime, Bob would likely be able to finish his sentence and then be released from prison. This is because the law that Bob was convicted under no longer exists, and so it would not be fair to continue to punish him for something that is no longer considered a crime. However, it is important to note that this is a complex legal issue and the specifics of Bob's situation would need to be carefully examined in order to determine the appropriate course of action.""]",0.0,0.0,1,1,1,2614,"Failed"
"['Plastic school chairs often have holes in the back of them because they are designed to be lightweight and easy to carry. The holes make the chairs lighter and more comfortable to sit in because they allow air to circulate around the back of the chair. Additionally, the holes can help reduce the amount of heat that builds up in the chair, which can make sitting in the chair for long periods of time more comfortable. Finally, the holes can also help to reduce the amount of material needed to make the chair, which can save money and resources. So, overall, the holes in plastic school chairs are there to make the chairs more comfortable and easier to use.']","['Plastic school chairs often have holes in the back of them because they are designed to be lightweight and easy to carry. The holes make the chairs lighter and more comfortable to sit in because they allow air to circulate around the back of the chair. Additionally, the holes can help reduce the amount of heat that builds up in the chair, which can make sitting in the chair for long periods of time more comfortable. Finally, the holes can also help to reduce the amount of material needed to make the chair, which can save money and resources. So, overall, the holes in plastic school chairs are there to make the chairs more comfortable and easier to use.']",0.0,0.0,1,1,1,2333,"Failed"
"['It is possible that the National Security Agency (NSA) may have had knowledge of certain public scandals before they became public, but it is also possible that they did not. The NSA is a intelligence agency that is primarily focused on gathering and analyzing information for national security purposes. This means that the agency may collect and analyze information about a wide range of topics, including potential scandals or crimes. However, the agency is not primarily focused on investigating or prosecuting these types of incidents, and it is not their role to make this information public. \nIf the NSA did have knowledge of a public scandal before it became public, it is possible that they may have kept this information to themselves for a variety of reasons. For example, they may have wanted to keep their sources and methods for gathering this information secret, or they may have determined that releasing the information could potentially harm national security interests. \nIn general, the NSA and other intelligence agencies are not in the business of making information public unless it is necessary for their mission of protecting national security. They typically work behind the scenes and do not reveal the information they gather or the methods they use to gather it, in order to protect their sources and methods and to avoid compromising ongoing operations.']","['It is possible that the National Security Agency (NSA) may have had knowledge of certain public scandals before they became public, but it is also possible that they did not. The NSA is a intelligence agency that is primarily focused on gathering and analyzing information for national security purposes. This means that the agency may collect and analyze information about a wide range of topics, including potential scandals or crimes. However, the agency is not primarily focused on investigating or prosecuting these types of incidents, and it is not their role to make this information public. \nIf the NSA did have knowledge of a public scandal before it became public, it is possible that they may have kept this information to themselves for a variety of reasons. For example, they may have wanted to keep their sources and methods for gathering this information secret, or they may have determined that releasing the information could potentially harm national security interests. \nIn general, the NSA and other intelligence agencies are not in the business of making information public unless it is necessary for their mission of protecting national security. They typically work behind the scenes and do not reveal the information they gather or the methods they use to gather it, in order to protect their sources and methods and to avoid compromising ongoing operations.']",0.0,0.0,1,1,1,4593,"Failed"
