"original_text","perturbed_text","original_score","perturbed_score","original_output","perturbed_output","ground_truth_output","num_queries","result_type"
"[""We 've only landed on planets and moons , which are all fairly big objects with substantial gravity . This is a comet , which is teensy by space standards , and has negligible gravity . We know next to zilch about comets , so just about everything this mission learns is going to be new .""<SPLIT> ""Planet = move slow , Comet = move fast . It 's more challenging , and therefore a bigger deal""<SPLIT> ""Simply put , location , location , location . We 've landed on the moon before , we 've landed on mars before , this is the first time we 've ever landed on a comet before . Imagine we discovered a new island in the pacific , the novelty of landing on it is n't less simply because we discovered Hawaii , right ? Comets are ice and rock , and therefore they are * water * . You know how big water is in space exploration , right ( hint : it 's * huge * ) ? We could find , for example , microbes , either living or frozen in the ice , life in space . Or , for the hell of it , we could just bring back * water from space * . Pretty cool , if you ask me .""]","[""We 've only landed on planets and moons , which are all fairly big objects with substantial gravity . This is a comet , which is teensy by space standards , and has negligible gravity . We know next to zilch about comets , so just about everything this mission learns is going to be new .""<SPLIT> ""Planet = move slow , Comet = move fast . It 's more challenging , and therefore a bigger deal""<SPLIT> ""Simply put , location , location , location . We 've landed on the moon before , we 've landed on mars before , this is the first time we 've ever landed on a comet before . Imagine we discovered a new island in the pacific , the novelty of landing on it is n't less simply because we discovered Hawaii , right ? Comets are ice and rock , and therefore they are * water * . You know how big water is in space exploration , right ( hint : it 's * huge * ) ? We could find , for example , microbes , either living or frozen in the ice , life in space . Or , for the hell of it , we could just bring back * water from space * . Pretty cool , if you ask me .""]",0.0,0.0,0,0,0,3791,"Failed"
"[""well , first you have to understand that the author created an artificial restriction . The machine will not mind - switch between two people who had directly switched their minds with one another . So if Fry switched with Amy , the two of them could never directly switch back . Without the artificial restriction this would n't even be a problem . And the solution to the self - made problem is the introduction of two people who have not been part of the experiment and basically puzzle - solve / jigsaw / Rubik 's cube people 's personalities back in order .""<SPLIT> 'Well it is not really a theorem it is just basic math . If would like star gate sg1 does a far better job explaining it with less people used . All you really need 1 new person and and for everyone else to shift one body over after that you can rebuild every one correctly .'<SPLIT> 'Is it the statement of the theorem or the proof that you want to understand ?']","[""well , first you have to understand that the author created an artificial restriction . The machine will not mind - switch between two people who had directly switched their minds with one another . So if Fry switched with Amy , the two of them could never directly switch back . Without the artificial restriction this would n't even be a problem . And the solution to the self - made problem is the introduction of two people who have not been part of the experiment and basically puzzle - solve / jigsaw / Rubik 's cube people 's personalities back in order .""<SPLIT> 'Well it is not really a theorem it is just basic math . If would like star gate sg1 does a far better job explaining it with less people used . All you really need 1 new person and and for everyone else to shift one body over after that you can rebuild every one correctly .'<SPLIT> 'Is it the statement of the theorem or the proof that you want to understand ?']",0.0,0.0,0,0,0,3123,"Failed"
"['A semi-colon is a punctuation mark that is used to separate clauses in a sentence. It is similar to a period, but it is used to connect clauses that are closely related in meaning. Here is an example of a sentence with a semi-colon: \n""I went to the store; I needed to buy some milk."" \nIn this sentence, the two clauses are ""I went to the store"" and ""I needed to buy some milk."" The semi-colon is used to connect these two clauses because they are closely related in meaning and are both part of the same thought. \nWe use semi-colons to help make our writing more clear and organized. They can be used to connect clauses that are not connected by a conjunction (such as ""and"" or ""but"") and to indicate a pause that is longer than a comma but shorter than a period. \nI hope this helps! Let me know if you have any other questions.']","['A semi-colon is a punctuation mark that is used to separate clauses in a sentence. It is similar to a period, but it is used to connect clauses that are closely related in meaning. Here is an example of a sentence with a semi-colon: \n""I went to the store; I needed to buy some milk."" \nIn this sentence, the two clauses are ""I went to the store"" and ""I needed to buy some milk."" The semi-colon is used to connect these two clauses because they are closely related in meaning and are both part of the same thought. \nWe use semi-colons to help make our writing more clear and organized. They can be used to connect clauses that are not connected by a conjunction (such as ""and"" or ""but"") and to indicate a pause that is longer than a comma but shorter than a period. \nI hope this helps! Let me know if you have any other questions.']",0.0,0.0,1,1,1,3034,"Failed"
"[""The short and unexciting answer , is that we ca n't really answer that question . Presumably the human brain would have evolved to represent these somehow , but it has n't , so we can only ' pretend ' to see them by essentially using technology to shift them into the visible spectrum . But some make - believe dust added and ... If you can see radiowaves , then astronomical objects , your radio , your wifi router , technological stuff in general , will put out lots of ' light ' . If you could see microwaves , well , the cosmic microwave radiation that fills the universe would presumably fill your vision with light everywhere , all the time , forever . I 'd find it kind of annoying honestly . It definitely would n't help you see very well . If you could see infrared , well , you 'd see akin to how infrared cameras present things , presumably . Blobs of ' light ' dependent upon temperature . Potentially useful in some respects , problematic in others . You could find a dropped cigarette pretty easily . Your girlfriend 's face would be a smear of light though . Ultraviolet light is given off by stars , televisions , certain lights , you 'd have essentially some overlap with things that already light up for you . If you could percieve x - rays , you 'd see dim shadows of the objects they pass through , like your neighbor 's skeleton . This of course would make seeing things as we do now kind of difficult . You would n't see anything different in the night sky from that though , as the atmosphere blocks it out . Gamma rays would be visible coming from radioactive stuff , and from the night sky . If intense enough , I suppose they would pierce through solid objects near you . In short , it 'd be a real pain in the ass , because you 'd be overwhelmed with ' light ' that would not correspond to solid objects in your vicinity particularly conveniently .""<SPLIT> '[ This ] ( URL_0 ) picture gives a sense of how the sky would look if we could "" see "" in radio ( and had eyes big enough to resolve celestial objects at that wavelength ) . The foreground is obviously a normal photograph but the sky shows all the radio - loud sources we would be able to see . Note that the scattered points that look like stars are actually radio galaxies and quasars .'<SPLIT> ""Of interest is that several animal species see other wavelengths . Deer and waterfowl can see some ultraviolet but not reds ( hence why people where blaze orange for deer ) . And I believe there 's a shrimp that lives in the deep see that can see in many different spectrums like the friggin Predator or something . URL_0 and more humorously put : URL_1""]","[""The short and unexciting answer , is that we ca n't really answer that question . Presumably the human brain would have evolved to represent these somehow , but it has n't , so we can only ' pretend ' to see them by essentially using technology to shift them into the visible spectrum . But some make - believe dust added and ... If you can see radiowaves , then astronomical objects , your radio , your wifi router , technological stuff in general , will put out lots of ' light ' . If you could see microwaves , well , the cosmic microwave radiation that fills the universe would presumably fill your vision with light everywhere , all the time , forever . I 'd find it kind of annoying honestly . It definitely would n't help you see very well . If you could see infrared , well , you 'd see akin to how infrared cameras present things , presumably . Blobs of ' light ' dependent upon temperature . Potentially useful in some respects , problematic in others . You could find a dropped cigarette pretty easily . Your girlfriend 's face would be a smear of light though . Ultraviolet light is given off by stars , televisions , certain lights , you 'd have essentially some overlap with things that already light up for you . If you could percieve x - rays , you 'd see dim shadows of the objects they pass through , like your neighbor 's skeleton . This of course would make seeing things as we do now kind of difficult . You would n't see anything different in the night sky from that though , as the atmosphere blocks it out . Gamma rays would be visible coming from radioactive stuff , and from the night sky . If intense enough , I suppose they would pierce through solid objects near you . In short , it 'd be a real pain in the ass , because you 'd be overwhelmed with ' light ' that would not correspond to solid objects in your vicinity particularly conveniently .""<SPLIT> '[ This ] ( URL_0 ) picture gives a sense of how the sky would look if we could "" see "" in radio ( and had eyes big enough to resolve celestial objects at that wavelength ) . The foreground is obviously a normal photograph but the sky shows all the radio - loud sources we would be able to see . Note that the scattered points that look like stars are actually radio galaxies and quasars .'<SPLIT> ""Of interest is that several animal species see other wavelengths . Deer and waterfowl can see some ultraviolet but not reds ( hence why people where blaze orange for deer ) . And I believe there 's a shrimp that lives in the deep see that can see in many different spectrums like the friggin Predator or something . URL_0 and more humorously put : URL_1""]",0.0,0.0,0,0,0,8168,"Failed"
"[""They also take in nutrients from the dirt . That 's how you can get things like iron etc .""<SPLIT> 'They do eat other stuff than water from the dirt . Phosphorus and stuff .'<SPLIT> 'In order to make sugars , a plant needs certain elements in its diet . It gets Carbon from the Carbon Dioxide in the air . It gets H2O from water . When it transfers in the water , it uses a tube in its stem , called the xylem . When this absorbs water from the soil below it , it carries nutrients in the soil occasionally , giving the organism certain vitamins and minerals . Of course , some plants will adapt to this , giving them a dependency or a new feeding pattern where they can mature faster with minerals .']","[""They also take in nutrients from the dirt . That 's how you can get things like iron etc .""<SPLIT> 'They do eat other stuff than water from the dirt . Phosphorus and stuff .'<SPLIT> 'In order to make sugars , a plant needs certain elements in its diet . It gets Carbon from the Carbon Dioxide in the air . It gets H2O from water . When it transfers in the water , it uses a tube in its stem , called the xylem . When this absorbs water from the soil below it , it carries nutrients in the soil occasionally , giving the organism certain vitamins and minerals . Of course , some plants will adapt to this , giving them a dependency or a new feeding pattern where they can mature faster with minerals .']",0.0,0.0,0,0,0,2137,"Failed"
"[""It 's for quality . Even if it does n't spoil when stored properly , honey can develop an off flavor over time . The date is a conservative estimate for when it might start to go off - not in the sense of being unsafe / spoiled , but in the sense of not tasting as good anymore . It also helps stores and warehouses with stock rotation .""<SPLIT> 'Many times a expiration date is required by law ( for another example canned food ) also it gets people that only use one jar of honey every x years to buy more'<SPLIT> 'Generally speaking if you have an expiration date on honey and it tastes strange after that date it was not really honey .']","[""It 's for quality . Even if it does n't spoil when stored properly , honey can develop an off flavor over time . The date is a conservative estimate for when it might start to go off - not in the sense of being unsafe / spoiled , but in the sense of not tasting as good anymore . It also helps stores and warehouses with stock rotation .""<SPLIT> 'Many times a expiration date is required by law ( for another example canned food ) also it gets people that only use one jar of honey every x years to buy more'<SPLIT> 'Generally speaking if you have an expiration date on honey and it tastes strange after that date it was not really honey .']",0.0,0.0,0,0,0,2425,"Failed"
"[""When you refinance a house, you are essentially taking out a new loan to pay off your existing mortgage. This can be done for a variety of reasons, such as to get a lower interest rate, to change the length of the loan, or to access the equity you have built up in your home. \nHere's an example of how refinancing might work: \nLet's say that you have a mortgage on your home with an interest rate of 5%. You've been paying on this mortgage for a few years and have built up some equity in your home. Now, you find out that you can refinance your mortgage and get a new loan with an interest rate of 4%. This would mean that you would be paying less in interest each month, which would lower your monthly mortgage payments. \nTo do this, you would need to apply for a new mortgage and go through the process of getting approved for the loan. Once you have been approved, the lender will pay off your old mortgage and give you a new loan with the lower interest rate. You will then make payments on this new loan instead of the old one. \nOverall, refinancing a house can be a good way to save money on your mortgage payments or to access the equity you have built up in your home. However, it's important to consider all of the costs associated with refinancing, such as closing costs, to make sure that it makes financial sense for you.""]","[""When you refinance a house, you are essentially taking out a new loan to pay off your existing mortgage. This can be done for a variety of reasons, such as to get a lower interest rate, to change the length of the loan, or to access the equity you have built up in your home. \nHere's an example of how refinancing might work: \nLet's say that you have a mortgage on your home with an interest rate of 5%. You've been paying on this mortgage for a few years and have built up some equity in your home. Now, you find out that you can refinance your mortgage and get a new loan with an interest rate of 4%. This would mean that you would be paying less in interest each month, which would lower your monthly mortgage payments. \nTo do this, you would need to apply for a new mortgage and go through the process of getting approved for the loan. Once you have been approved, the lender will pay off your old mortgage and give you a new loan with the lower interest rate. You will then make payments on this new loan instead of the old one. \nOverall, refinancing a house can be a good way to save money on your mortgage payments or to access the equity you have built up in your home. However, it's important to consider all of the costs associated with refinancing, such as closing costs, to make sure that it makes financial sense for you.""]",0.0,0.0,1,1,1,4747,"Failed"
"[""I was an early adopter of Paypal . It pretty much grew side by side with ebay , back when ebay used to close on Fridays for maintenance ( No , I am not joking ) . If you bought anything off ebay , the only way to pay was money order , western union , cheque , or maybe give them your credit card . Most banks did nt have internet banking , so to do a bank transfer required standing in line while the bank was actually open . So that was not even an option . There just like today there was also a lot of scammers . Cheques bounced constantly , there is no way you could have given anybody your credit card and think it was safe . Paypal came in just at the time that ebay was booming , and it 's customers needed a way to transfer money safely and easily . At the beginning , they had zero to low fees , and guaranteed your money safe . There were other competitors as well in the early days . Paymate , paysafe , Western Union also went digital quite early too ( and was an ebay preferred payment method ) . But Paypal become the easy winner through numbers . When ebay bought paypal and integrated them into their system , that 's when they became pretty much universal .""<SPLIT> 'There is a video [ Here ] ( URL_0 ) with Elon Musk where he talks for a minute about the start of Paypal . Apparently , they offered people a monetary sign - up bonus . Guess free money is enough for some people to sign up , good business practice causes a build - up from there .'<SPLIT> 'I remember the early days of Paypal where they would give you $ 5 for signing up . That probably was helpful in developing a customer base at first .']","[""I was an early adopter of Paypal . It pretty much grew side by side with ebay , back when ebay used to close on Fridays for maintenance ( No , I am not joking ) . If you bought anything off ebay , the only way to pay was money order , western union , cheque , or maybe give them your credit card . Most banks did nt have internet banking , so to do a bank transfer required standing in line while the bank was actually open . So that was not even an option . There just like today there was also a lot of scammers . Cheques bounced constantly , there is no way you could have given anybody your credit card and think it was safe . Paypal came in just at the time that ebay was booming , and it 's customers needed a way to transfer money safely and easily . At the beginning , they had zero to low fees , and guaranteed your money safe . There were other competitors as well in the early days . Paymate , paysafe , Western Union also went digital quite early too ( and was an ebay preferred payment method ) . But Paypal become the easy winner through numbers . When ebay bought paypal and integrated them into their system , that 's when they became pretty much universal .""<SPLIT> 'There is a video [ Here ] ( URL_0 ) with Elon Musk where he talks for a minute about the start of Paypal . Apparently , they offered people a monetary sign - up bonus . Guess free money is enough for some people to sign up , good business practice causes a build - up from there .'<SPLIT> 'I remember the early days of Paypal where they would give you $ 5 for signing up . That probably was helpful in developing a customer base at first .']",0.0,0.0,0,0,0,5704,"Failed"
"[""A big reason is fat - in cold water fat is solid , sticks to your washing up and is very hard to remove . In hot water it liquefies and is easily removed . Commercial dishwashers use boiling water which also disinfects the dishes , hot taps in houses do n't get hot enough for that .""<SPLIT> 'Water can dissolve more things ( as in more quantity ) when hot than when cold . Plus sticking your hands in cold water sucks .'<SPLIT> 'Heat is the catalyst for energizing molecules ( or making them move faster),enhancing your ability to remove food / germs / bacteria from the dishes .']","[""A big reason is fat - in cold water fat is solid , sticks to your washing up and is very hard to remove . In hot water it liquefies and is easily removed . Commercial dishwashers use boiling water which also disinfects the dishes , hot taps in houses do n't get hot enough for that .""<SPLIT> 'Water can dissolve more things ( as in more quantity ) when hot than when cold . Plus sticking your hands in cold water sucks .'<SPLIT> 'Heat is the catalyst for energizing molecules ( or making them move faster),enhancing your ability to remove food / germs / bacteria from the dishes .']",0.0,0.0,0,0,0,2145,"Failed"
"['When you receive a text , the network wo nt blindly send it to you . Instead , the network and your phone will first establish the connection , like this : "" Yo phone , you there ? "" "" Yea I \'m here "" "" Cool , I got a text for you , where are you ? "" "" * * I \'m here you stupid bitch * * "" "" Oh okay , I hear you at 6/10 . Setting power level to 4 . Here , take your text "" "" thanks "" It \'s the shouting part you hear . Power conservation is very important on mobile networks , so the phones and the base stations will adjust their signal power to work optimally . When the phone is creating connection though , it will for a short time transmit at full power , and this is what causes the most interference in your devices .'<SPLIT> 'Radio frequency interference , in order to meet FCC regulations , things like radios and phones have to be able to accept interference , your hearing the invisible radio waves that send data to your phone .'<SPLIT> ""My old phone used to do that when I would set it beside my headphone cable . It 's GSM interference getting picked up by something ( the antenna , or some speaker cable or something ) . If you can figure out which cable is doing it you can replace it with shielded cable .""]","['When you receive a text , the network wo nt blindly send it to you . Instead , the network and your phone will first establish the connection , like this : "" Yo phone , you there ? "" "" Yea I \'m here "" "" Cool , I got a text for you , where are you ? "" "" * * I \'m here you stupid bitch * * "" "" Oh okay , I hear you at 6/10 . Setting power level to 4 . Here , take your text "" "" thanks "" It \'s the shouting part you hear . Power conservation is very important on mobile networks , so the phones and the base stations will adjust their signal power to work optimally . When the phone is creating connection though , it will for a short time transmit at full power , and this is what causes the most interference in your devices .'<SPLIT> 'Radio frequency interference , in order to meet FCC regulations , things like radios and phones have to be able to accept interference , your hearing the invisible radio waves that send data to your phone .'<SPLIT> ""My old phone used to do that when I would set it beside my headphone cable . It 's GSM interference getting picked up by something ( the antenna , or some speaker cable or something ) . If you can figure out which cable is doing it you can replace it with shielded cable .""]",0.0,0.0,0,0,0,3885,"Failed"
"['Dogs bark for a variety of reasons, such as to alert their owners of something, to communicate with other dogs, or to express excitement or frustration. Some dogs are more prone to barking than others, and some breeds are known for being more vocal than others. \nPeople can only scream for a short period of time because our bodies are not built to handle the strain of screaming for long periods of time. Screaming uses a lot of energy and can be very tiring, which is why people can only do it for a short period of time before they need to rest. \nDogs, on the other hand, are built differently and are able to bark for longer periods of time without getting as tired. Dogs also have different vocal cords than humans, which may make it easier for them to bark for longer periods of time without damaging their vocal cords.']","['Dogs bark for a variety of reasons, such as to alert their owners of something, to communicate with other dogs, or to express excitement or frustration. Some dogs are more prone to barking than others, and some breeds are known for being more vocal than others. \nPeople can only scream for a short period of time because our bodies are not built to handle the strain of screaming for long periods of time. Screaming uses a lot of energy and can be very tiring, which is why people can only do it for a short period of time before they need to rest. \nDogs, on the other hand, are built differently and are able to bark for longer periods of time without getting as tired. Dogs also have different vocal cords than humans, which may make it easier for them to bark for longer periods of time without damaging their vocal cords.']",0.0,0.0,1,1,1,3296,"Failed"
