"original_text","perturbed_text","original_score","perturbed_score","original_output","perturbed_output","ground_truth_output","num_queries","result_type"
"[""There is actually a lot of information available about the oceans and deep sea exploration, it's just that the oceans are much harder to study and explore than outer space. The oceans cover about 70% of the Earth's surface and are much deeper than the highest mountains, so they are much harder to get to and study. In addition, the water in the oceans is very cold, dark, and pressure is very high at greater depths, which makes it difficult for humans and instruments to survive and work. \nOn the other hand, outer space is much easier to study because we can send telescopes and other instruments up into orbit or even beyond our own solar system to study the stars and other celestial objects. These instruments can take pictures and make measurements of these objects and send the information back to Earth, where scientists can study it. \nSo while there is still a lot that we don't know about the oceans and deep sea exploration, scientists and researchers are constantly working to learn more and improve our understanding of these mysterious and fascinating environments.""]","[""There is actually a lot of information available about the oceans and deep sea exploration, it's just that the oceans are much harder to study and explore than outer space. The oceans cover about 70% of the Earth's surface and are much deeper than the highest mountains, so they are much harder to get to and study. In addition, the water in the oceans is very cold, dark, and pressure is very high at greater depths, which makes it difficult for humans and instruments to survive and work. \nOn the other hand, outer space is much easier to study because we can send telescopes and other instruments up into orbit or even beyond our own solar system to study the stars and other celestial objects. These instruments can take pictures and make measurements of these objects and send the information back to Earth, where scientists can study it. \nSo while there is still a lot that we don't know about the oceans and deep sea exploration, scientists and researchers are constantly working to learn more and improve our understanding of these mysterious and fascinating environments.""]",0.0,0.0,1,1,1,3702,"Failed"
"[""An amp (ampere) is a unit of electrical current. It measures the flow of electrons in a circuit. \nA volt (voltage) is a unit of electrical potential difference. It measures the pressure that drives electrons through a circuit. \nA watt is a unit of power. It measures the rate at which energy is transferred or used. \nHere's an example to help you understand the difference between these three units: \nImagine a water pipe with water flowing through it. The amps would be like the amount of water flowing through the pipe. The volts would be like the pressure of the water. And the watts would be like the rate at which the water is flowing and doing work (such as turning a turbine to generate electricity). \nSo, in short: \nAmps measure the flow of electrons (current).\nVolts measure the pressure that drives the electrons through the circuit (voltage).\nWatts measure the rate at which energy is being transferred or used (power).""]","[""An amp (ampere) is a unit of electrical current. It measures the flow of electrons in a circuit. \nA volt (voltage) is a unit of electrical potential difference. It measures the pressure that drives electrons through a circuit. \nA watt is a unit of power. It measures the rate at which energy is transferred or used. \nHere's an example to help you understand the difference between these three units: \nImagine a water pipe with water flowing through it. The amps would be like the amount of water flowing through the pipe. The volts would be like the pressure of the water. And the watts would be like the rate at which the water is flowing and doing work (such as turning a turbine to generate electricity). \nSo, in short: \nAmps measure the flow of electrons (current).\nVolts measure the pressure that drives the electrons through the circuit (voltage).\nWatts measure the rate at which energy is being transferred or used (power).""]",0.0,0.0,1,1,1,2594,"Failed"
"[""You are reducing the demand for meat , a supermarket is n't going to buy more meat if they are still stocked fully stocked .""<SPLIT> ""It 's like voting ... your vote , on its own , does n't matter at all . But if everyone felt that way and did n't bother to vote , the system would n't work . In parallel , you not buying meat makes absolutely zero difference . You wo n't save even one animal . But the vegetarian movement as a whole can reduce consumer demand and thus reduce the number of animals killed for meat .""<SPLIT> ""It does n't necessarily help the animals . But it also does n't * hurt * the animals , which means that individual can eat with a clear conscience .""]","[""You are reducing the demand for meat , a supermarket is n't going to buy more meat if they are still stocked fully stocked .""<SPLIT> ""It 's like voting ... your vote , on its own , does n't matter at all . But if everyone felt that way and did n't bother to vote , the system would n't work . In parallel , you not buying meat makes absolutely zero difference . You wo n't save even one animal . But the vegetarian movement as a whole can reduce consumer demand and thus reduce the number of animals killed for meat .""<SPLIT> ""It does n't necessarily help the animals . But it also does n't * hurt * the animals , which means that individual can eat with a clear conscience .""]",0.0,0.0,0,0,0,2455,"Failed"
"[""It 's only been a few months , it takes a few years to go from idea to the road .""<SPLIT> ""Teslas batteries are nt really all that special . The cells are Panasonic 's 18650 's . A lot of them . Teslas patents revolve around the pack systems . Safety systems , monitoring systems , etc . Building a big 60kwh battery pack is n't a big engineering deal . DIY people do their own and a lot of battery pack companies specialize in the industry . Its more the battery charging and monitoring systems that differentiate .""<SPLIT> ""They do n't have properly tooled production factories yet , or there is some technical tradeoff that makes the tesla batteries not appropriate for their existing designs .""]","[""It 's only been a few months , it takes a few years to go from idea to the road .""<SPLIT> ""Teslas batteries are nt really all that special . The cells are Panasonic 's 18650 's . A lot of them . Teslas patents revolve around the pack systems . Safety systems , monitoring systems , etc . Building a big 60kwh battery pack is n't a big engineering deal . DIY people do their own and a lot of battery pack companies specialize in the industry . Its more the battery charging and monitoring systems that differentiate .""<SPLIT> ""They do n't have properly tooled production factories yet , or there is some technical tradeoff that makes the tesla batteries not appropriate for their existing designs .""]",0.0,0.0,0,0,0,2098,"Failed"
"['Technically . Unless you some how like every individual black person by their own merit liking a group because of their race is racist .'<SPLIT> ""Yes , because you 're still saying that there are some attributes that you love that all members of that race possess . It 's still racism , though not discrimination , because you 're being inclusive rather than exclusive .""<SPLIT> 'It begs the question- "" why the fuck did you have to say that "" . Normally I guess we assume that people are n\'t racist , and this stuff does n\'t need to be pointed out .']","['Technically . Unless you some how like every individual black person by their own merit liking a group because of their race is racist .'<SPLIT> ""Yes , because you 're still saying that there are some attributes that you love that all members of that race possess . It 's still racism , though not discrimination , because you 're being inclusive rather than exclusive .""<SPLIT> 'It begs the question- "" why the fuck did you have to say that "" . Normally I guess we assume that people are n\'t racist , and this stuff does n\'t need to be pointed out .']",0.0,0.0,0,0,0,1501,"Failed"
"[""Dispatcher here . I dispatch for a sheriffs office in a ski county . Our dispatch center dispatches for the county deputies , the state troopers , the park rangers , the wildlife officers , the US forest service officers , and local fire and EMS . As far dispatching law enforcement goes , each agency has a certain jurisdiction , and if a call happens in their jurisdiction we usually send one ( or multiple ) units depending on the call . For example the state troopers take all of the calls on the state roads and interstates ( accidents , traffic violations , road hazards , suspicious vehicles on the interstate , etc ) . The county deputies take all of the calls on county roads , and county property . These calls may include domestic violence calls at a citizens houses , burglary alarms , citizen complains against each other , welfare checks , and civil problems . They also patrol the area proactively trying to prevent crime . They have a job very similar to a city police officer . The park rangers take care of all of the problems in state park jurisdiction , and the wildlife officers generally ride around on ATVS and look for poachers , and take care of the wildlife people encounter on their property . The US forest officer takes the calls in the national forest in our jurisdiction and patrols the highway the passes through it . He may also receive help from our deputies if need be because we have a deputy whose zone passes through his national forest . We also have a local police department in the area , but their dispatch is in another location and we occasionally coordinate . We can hear each others radio traffic , but do n't dispatch each others officers . Now , there are about 6 troopers ( Highway patrol ) on air in the busiest time , and they are separated into 3 zones . Each trooper is assigned a zone , and if we receive a call in their zone we generally ask them to respond . If all the troopers in their zone are unavailable , we ask the officer in charge to advise . The deputies have 4 zones with 6 deputies on duty . 4 deputies have their own zone ( so one in each zone ) and there is a float who will respond to any call if an officer is busy , and another call comes in in their zone . There is also a SGT on duty who is the boss of the crew . If a call comes in their zone , they are dispatched to it , and if deputies from another zone come to assist , the officer who is assigned to that zone will be in charge of the call ( write the big report , and if needed , take the prisoner into the jail ) . When we take a call our system automatically recognizes the address and maps it for us , and we can see whose zone it is in , and we send that unit . Generally , there is a unit available to assist if they need backup , and all officers in every agency will back each other if they feel they are in a dangerous situation . We have a computer aided dispatch system that tracks all of the calls , and what every unit is doing , so we know if they are available , unavailable , their location and how long they have been on that call so we can security check them if need be . I 'm not going into detail with any other agency besides the highway patrol and Sherrifs deputies because they all pretty much have one zone . I hope this covers at least a small chunk of curiosity . Feel free to ask more questions , because I 'm sure I 've probably made no sense . Oh , and they know the address because it shows up on their mobile dispatch center on their computer in their vehicle , and we always tell them when we dispatch them on the call .""<SPLIT> ""Depends on the size of the department . Large departments usually have computers in their cars to see what 's pending . They can assign themselves to it or the dispatcher can give them the basics and they look it up on the computer . But there is n't a uniform way things are done for all US agencies , so your local department could easily be very different .""<SPLIT> 'Short answer : 911 call comes in - > dispatcher takes call and documents information in a call log in the computer - > call goes to a radio - > radio dispatcher goes out over the air to unit using brevity codes ( these codes differ between agencies but tell the officers what type of call it is ) - > officer copies call and responds Address is given to the officer when call is dispatched along with any other important information .']","[""Dispatcher here . I dispatch for a sheriffs office in a ski county . Our dispatch center dispatches for the county deputies , the state troopers , the park rangers , the wildlife officers , the US forest service officers , and local fire and EMS . As far dispatching law enforcement goes , each agency has a certain jurisdiction , and if a call happens in their jurisdiction we usually send one ( or multiple ) units depending on the call . For example the state troopers take all of the calls on the state roads and interstates ( accidents , traffic violations , road hazards , suspicious vehicles on the interstate , etc ) . The county deputies take all of the calls on county roads , and county property . These calls may include domestic violence calls at a citizens houses , burglary alarms , citizen complains against each other , welfare checks , and civil problems . They also patrol the area proactively trying to prevent crime . They have a job very similar to a city police officer . The park rangers take care of all of the problems in state park jurisdiction , and the wildlife officers generally ride around on ATVS and look for poachers , and take care of the wildlife people encounter on their property . The US forest officer takes the calls in the national forest in our jurisdiction and patrols the highway the passes through it . He may also receive help from our deputies if need be because we have a deputy whose zone passes through his national forest . We also have a local police department in the area , but their dispatch is in another location and we occasionally coordinate . We can hear each others radio traffic , but do n't dispatch each others officers . Now , there are about 6 troopers ( Highway patrol ) on air in the busiest time , and they are separated into 3 zones . Each trooper is assigned a zone , and if we receive a call in their zone we generally ask them to respond . If all the troopers in their zone are unavailable , we ask the officer in charge to advise . The deputies have 4 zones with 6 deputies on duty . 4 deputies have their own zone ( so one in each zone ) and there is a float who will respond to any call if an officer is busy , and another call comes in in their zone . There is also a SGT on duty who is the boss of the crew . If a call comes in their zone , they are dispatched to it , and if deputies from another zone come to assist , the officer who is assigned to that zone will be in charge of the call ( write the big report , and if needed , take the prisoner into the jail ) . When we take a call our system automatically recognizes the address and maps it for us , and we can see whose zone it is in , and we send that unit . Generally , there is a unit available to assist if they need backup , and all officers in every agency will back each other if they feel they are in a dangerous situation . We have a computer aided dispatch system that tracks all of the calls , and what every unit is doing , so we know if they are available , unavailable , their location and how long they have been on that call so we can security check them if need be . I 'm not going into detail with any other agency besides the highway patrol and Sherrifs deputies because they all pretty much have one zone . I hope this covers at least a small chunk of curiosity . Feel free to ask more questions , because I 'm sure I 've probably made no sense . Oh , and they know the address because it shows up on their mobile dispatch center on their computer in their vehicle , and we always tell them when we dispatch them on the call .""<SPLIT> ""Depends on the size of the department . Large departments usually have computers in their cars to see what 's pending . They can assign themselves to it or the dispatcher can give them the basics and they look it up on the computer . But there is n't a uniform way things are done for all US agencies , so your local department could easily be very different .""<SPLIT> 'Short answer : 911 call comes in - > dispatcher takes call and documents information in a call log in the computer - > call goes to a radio - > radio dispatcher goes out over the air to unit using brevity codes ( these codes differ between agencies but tell the officers what type of call it is ) - > officer copies call and responds Address is given to the officer when call is dispatched along with any other important information .']",0.0,0.0,0,0,0,15738,"Failed"
"['Cancer is a disease in which cells in the body grow and multiply in an uncontrolled way. When cancer cells form a mass or tumor, it can be treated by surgically removing the tumor. However, cancer cells can also spread, or metastasize, to other parts of the body. In this case, removing the tumor alone may not be enough to cure the cancer. \nFor example, if someone has testicular cancer and the cancer has spread to other parts of their body, such as their lymph nodes or lungs, removing the testicles (a procedure called orchiectomy) would not be sufficient to treat the cancer. In this case, the person would need additional treatments, such as chemotherapy or radiation therapy, to kill any remaining cancer cells and prevent the cancer from returning. \nIt is important to note that in many cases, testicular cancer is caught early and can be treated with surgery alone. However, it is always important to discuss all treatment options with a healthcare professional to determine the best course of action.']","['Cancer is a disease in which cells in the body grow and multiply in an uncontrolled way. When cancer cells form a mass or tumor, it can be treated by surgically removing the tumor. However, cancer cells can also spread, or metastasize, to other parts of the body. In this case, removing the tumor alone may not be enough to cure the cancer. \nFor example, if someone has testicular cancer and the cancer has spread to other parts of their body, such as their lymph nodes or lungs, removing the testicles (a procedure called orchiectomy) would not be sufficient to treat the cancer. In this case, the person would need additional treatments, such as chemotherapy or radiation therapy, to kill any remaining cancer cells and prevent the cancer from returning. \nIt is important to note that in many cases, testicular cancer is caught early and can be treated with surgery alone. However, it is always important to discuss all treatment options with a healthcare professional to determine the best course of action.']",0.0,0.0,1,1,1,3681,"Failed"
"['Cuddling with animals can be a way for people to feel comforted and relaxed. Many people find the presence of animals to be soothing and enjoy the feeling of being close to them. It can also be a way for people to show affection and care for the animals they love. Dogs and cats are often considered to be particularly cuddly and affectionate animals, which may be part of the reason why people enjoy cuddling with them. Ultimately, the desire to cuddle with animals is a personal preference and can vary from person to person.']","['Cuddling with animals can be a way for people to feel comforted and relaxed. Many people find the presence of animals to be soothing and enjoy the feeling of being close to them. It can also be a way for people to show affection and care for the animals they love. Dogs and cats are often considered to be particularly cuddly and affectionate animals, which may be part of the reason why people enjoy cuddling with them. Ultimately, the desire to cuddle with animals is a personal preference and can vary from person to person.']",0.0,0.0,1,1,1,2066,"Failed"
"['they use lots and lots of cameras , all arranged in a ring and synchronized together , then you just switch the feed from one camera to another within the same time stamp .'<SPLIT> ""It 's an array of cameras . I built one you can see at : 56 URL_0 You take a series of pictures from a single moment in time . You play them back in series . You need one camera per frame . If you want half a second you need 15 cameras . If you want to extend the time , you can use techniques like twixtor or photogrammetry .""<SPLIT> ""Yes , as other have mentioned , it 's done with multiple cameras . But in planned scenes ( not live as in the example you posted and the [ Matrix movies ] ( URL_1 ) ) there are ways you can do it with a single camera and some added effects . Check out this tutorial by Film Riot : [ URL_0 ] ( URL_0 )""]","['they use lots and lots of cameras , all arranged in a ring and synchronized together , then you just switch the feed from one camera to another within the same time stamp .'<SPLIT> ""It 's an array of cameras . I built one you can see at : 56 URL_0 You take a series of pictures from a single moment in time . You play them back in series . You need one camera per frame . If you want half a second you need 15 cameras . If you want to extend the time , you can use techniques like twixtor or photogrammetry .""<SPLIT> ""Yes , as other have mentioned , it 's done with multiple cameras . But in planned scenes ( not live as in the example you posted and the [ Matrix movies ] ( URL_1 ) ) there are ways you can do it with a single camera and some added effects . Check out this tutorial by Film Riot : [ URL_0 ] ( URL_0 )""]",0.0,0.0,0,0,0,2429,"Failed"
"[""They do n't really give a shit about victims of bullying , they 're just trying to keep everyone in line so it 's not total chaos . Defend yourself , fuck authority . Who cares if you get in trouble ? If your parents are gon na punish you for getting in trouble at school for defending yourself , they do n't really give a shit about you either .""<SPLIT> ""Schools are notorious for having a total crappy attitude towards bullying and very rarely put in any actual investigating to determine what happened in an incident . It 's easy for them to just punish both parties and be done with it than to actually figure out what happened and only punish the aggressor .""<SPLIT> 'Well , we \'re only hearing your side of the story , but I \'m assuming you \'re a kid at school that got into a fight . The school administrators do n\'t really care "" who started it , "" they do n\'t want fighting to occur in the first place . Unless someone was there / a camera saw it they probably are n\'t going to be able to really figure out "" who started it "" so they might just suspend everyone involved .']","[""They do n't really give a shit about victims of bullying , they 're just trying to keep everyone in line so it 's not total chaos . Defend yourself , fuck authority . Who cares if you get in trouble ? If your parents are gon na punish you for getting in trouble at school for defending yourself , they do n't really give a shit about you either .""<SPLIT> ""Schools are notorious for having a total crappy attitude towards bullying and very rarely put in any actual investigating to determine what happened in an incident . It 's easy for them to just punish both parties and be done with it than to actually figure out what happened and only punish the aggressor .""<SPLIT> 'Well , we \'re only hearing your side of the story , but I \'m assuming you \'re a kid at school that got into a fight . The school administrators do n\'t really care "" who started it , "" they do n\'t want fighting to occur in the first place . Unless someone was there / a camera saw it they probably are n\'t going to be able to really figure out "" who started it "" so they might just suspend everyone involved .']",0.0,0.0,0,0,0,4075,"Failed"
